{
  "agent_id": "TELOS-Labs-AI/public-benchmark-projection",
  "covered_fields": "payload (canonical JSON, sort_keys, compact separators)",
  "engine": "telos v0.1 (unsigned integrity-hash; no governance engine wired)",
  "integrity_hash": "sha256:0f7a0cf9c137739aa0afa37e376e600d7bed49bdbc2e458ea874d1f9a608e3b3",
  "issued_at": "2026-07-14T10:04:01.537041Z",
  "kind": "benchmark_reverification_projection",
  "payload": {
    "benchmark": "AgentDojo",
    "current": "COULD-NOT-RUN",
    "disposition": "COULD-NOT-RUN",
    "expected_count": 139,
    "previous_receipt_integrity_hash": "sha256:7c5d3f2dd6a67e0341d2997eedb3b2ed56fe461280f4a82775400342fc8c39b5",
    "published": "100% injection detection; 52.2% overall correctness; 0% benign pass",
    "published_source": "10.5281/zenodo.18565869",
    "sequence": 8,
    "source_chain_entry_hash": "ab0233c17dcf9febf1eabdace67479395ea108c11d7105c9d2477a73258e0378",
    "source_chain_sequence": 26
  },
  "receipt_version": "telos/0.1-unsigned",
  "signature": null,
  "signing_status": "unsigned_integrity_hash"
}
