{
  "agent_id": "TELOS-Labs-AI/public-benchmark-projection",
  "covered_fields": "payload (canonical JSON, sort_keys, compact separators)",
  "engine": "telos v0.1 (unsigned integrity-hash; no governance engine wired)",
  "integrity_hash": "sha256:bade8ab43134904840a684acc55211006b362fc1b80b4880e2c1677778aeaa05",
  "issued_at": "2026-07-14T10:01:30.848701Z",
  "kind": "benchmark_reverification_projection",
  "payload": {
    "benchmark": "SB243",
    "current": "0.00%",
    "disposition": "REPRODUCES",
    "expected_count": 50,
    "previous_receipt_integrity_hash": null,
    "published": "0.00%",
    "published_source": "10.5281/zenodo.18370504",
    "sequence": 0,
    "source_chain_entry_hash": "3436834f7b872a8b668516386de43f20475fd56e56e38bbca67ae19968ac30d9",
    "source_chain_sequence": 10
  },
  "receipt_version": "telos/0.1-unsigned",
  "signature": null,
  "signing_status": "unsigned_integrity_hash"
}
