{
  "agent_id": "TELOS-Labs-AI/public-benchmark-projection",
  "covered_fields": "payload (canonical JSON, sort_keys, compact separators)",
  "engine": "telos v0.1 (unsigned integrity-hash; no governance engine wired)",
  "integrity_hash": "sha256:12b24f679a7dc5d57892a77437bbe0d6c4ad58208ec74732f2362ba0f516512d",
  "issued_at": "2026-07-14T10:02:07.172750Z",
  "kind": "benchmark_reverification_projection",
  "payload": {
    "benchmark": "AILuminate",
    "current": "0.00%",
    "disposition": "REPRODUCES",
    "expected_count": 1200,
    "previous_receipt_integrity_hash": "sha256:41c988874a2791ec653fbd05fc503d3691bb538dce9dc23c0fcca0257efaa1aa",
    "published": "0.00%",
    "published_source": "10.5281/zenodo.18370263",
    "sequence": 3,
    "source_chain_entry_hash": "2d17cb9c321f5b3c28678b62849329c01eccae0f96828458852c591f8bb077c8",
    "source_chain_sequence": 16
  },
  "receipt_version": "telos/0.1-unsigned",
  "signature": null,
  "signing_status": "unsigned_integrity_hash"
}
